ten_quan,dia_chi,so_dien_thoai,rating,gio_mo_cua,lat,lon,gia_trung_binh,thuc_don,hinh_anh,data_id,khau_vi,mo_ta
Xôi Làng Nghề Quận 1,"11E Nguyễn Thị Minh Khai, Bến Nghé, Quận 1, Thành phố Hồ Chí Minh, Việt Nam",+84 988 908 986,4.2,Mở cửa vào 6:15 ⋅ Đóng cửa vào 19:00,10.7861537,106.701323,1-100.000 ₫,,,0x31752f9d0e604903:0x6ceed371ef18b9bb,,
Xôi Làng Nghề - Chuẩn Vị Bắc - Xôi Xéo,"116 Ngô Tất Tố, P.22, Bình Thạnh, Thành phố Hồ Chí Minh, Việt Nam",+84 988 908 986,4.5,Mở cửa lúc 16:00 ⋅ Đóng cửa vào 20:00,10.7911872,106.714542,1-100.000 ₫,,,0x317529b81b23a71b:0xc134b8bcc1b98a63,,
Saigon Xoi Bap lady,"24 Nguyễn Hữu Cầu, Phường Tân Định, Quận 1, Thành phố Hồ Chí Minh, Việt Nam",+84 937 775 359,4.7,Mở cửa vào 13:00 ⋅ Đóng cửa vào 18:00,10.7913157,106.6911697,1-100.000 ₫,,,0x317528cce1716d95:0x82f9a91aa3155944,,
Xôi Gà Truyền Thống 295,"295 Hai Bà Trưng, Phường Võ Thị Sáu, Quận 3, Thành phố Hồ Chí Minh, Việt Nam",+84 937 537 433,4.5,Mở cửa vào 5:30 ⋅ Đóng cửa vào 20:00,10.7889287,106.6901358,1-100.000 ₫,,,0x31752f057b6e0a6d:0xf16a60c582ae669,,
Xôi Nếp Than Cô Thuý,"QMPH+HP3, 209/24 Đ. Lê Văn Sỹ, Phường 12, Quận 3, Thành phố Hồ Chí Minh 700000, Việt Nam",,4.5,Mở cửa vào 13:00 ⋅ Đóng cửa vào 18:00,10.786365,106.679312,1-100.000 ₫,,,0x31752f2bb5215aa9:0xd7cd8ee4b02b2c3a,,
Xôi Ngọc,"509 Cách Mạng Tháng Tám, Phường 13, Quận 10, Thành phố Hồ Chí Minh, Việt Nam",,4.2,Mở cửa lúc 17:00 ⋅ Đóng cửa vào 21:00,10.7824121,106.672719,1-100.000 ₫,,,0x31752f9b9fb99fc7:0xde0872bf136b8e17,,
Pizza 4P's Bến Thành,"8 Thủ Khoa Huân, Phường Bến Thành, Quận 1, Thành phố Hồ Chí Minh 700000, Việt Nam",+84 1900 6043,4.9,Mở cửa lúc 10:00 ⋅ Đóng cửa vào 0:00,10.773361,106.6976173,$$,,,0x31752f7998588b7d:0x8f43f3d4a8472384,,
Italiani's Pizza F5 Diamond Plaza,"Trung tâm thương mại Diamond Plaza, 34 Lê Duẩn, Bến Nghé, Quận 1, Thành phố Hồ Chí Minh 70000, Việt Nam",+84 901 453 194,4.9,Mở cửa lúc 10:00 ⋅ Đóng cửa vào 22:00,10.7807005,106.6983594,,,,0x31752f3192468409:0x907bafa3be04cc4d,,
Trần Pizza,"215B Nguyễn Trãi, Phường Nguyễn Cư Trinh, Quận 1, Thành phố Hồ Chí Minh, Việt Nam",+84 356 701 285,4.8,Mở cửa lúc 10:00 ⋅ Đóng cửa vào 21:00,10.7654096,106.6882963,100-200 N ₫,,,0x31752f006a3e0da1:0x6a0a10d4ede92cbb,,
Italiani's Pizza Han Thuyen,"17 Hàn Thuyên, Bến Nghé, Quận 1, Ho Chi Minh, Việt Nam",+84 909 974 992,4.7,Mở cửa lúc 10:00 ⋅ Đóng cửa vào 21:45,10.778856099999999,106.6982216,200-300 N ₫,,,0x31752f378ca73563:0x216c142b50bae4b2,,
Amano Pizza,"39/1 Nguyễn Trãi, Phường Bến Thành, Quận 1, Thành phố Hồ Chí Minh 700000, Việt Nam",+84 399 526 266,4.6,Mở cửa lúc 9:00 ⋅ Đóng cửa vào 22:00,10.7703138,106.6927268,200-300 N ₫,,,0x31752fc136292f31:0xa0cba2bf2a2fa867,,
Terraviva Pizza & Italian Cuisine Bến Thành,"194 Lê Thánh Tôn, Phường Bến Thành, Quận 1, Thành phố Hồ Chí Minh 700000, Việt Nam",+84 903 696 194,4.8,Mở cửa lúc 9:00 ⋅ Đóng cửa vào 22:00,10.7729083,106.6970365,$$,,,0x31752f4bcd0c7619:0x5544bd538f102320,,
Lamie Pizza,"158/4 Nguyễn Công Trứ, Phường Nguyễn Thái Bình, Quận 1, Thành phố Hồ Chí Minh 700000, Việt Nam",+84 866 922 040,4.9,Mở cửa lúc 9:00 ⋅ Đóng cửa vào 23:00,10.769093999999999,106.701367,100-200 N ₫,,,0x31752f4ed002f081:0x7888b59afad44a46,,
Pizza 4P's Saigon Centre,"01, Saigon Centre, 02 Lầu 6/65 Lê Lợi, Bến Nghé, Quận 1, Thành phố Hồ Chí Minh, Việt Nam",+84 1900 6043,4.9,Mở cửa lúc 10:00 ⋅ Đóng cửa vào 21:30,10.7733616,106.7005025,$$,,,0x31752f343bc5efc3:0x9bd9cfb7eb58a1a9,,
Pizza 4P’s Võ Văn Kiệt,"608 Võ Văn Kiệt, Cầu Kho, Quận 1, Thành phố Hồ Chí Minh 700000, Việt Nam",+84 1900 6043,4.9,Mở cửa lúc 9:00 ⋅ Đóng cửa vào 23:00,10.755108199999999,106.6876645,$$,,,0x31752f50232239cb:0x6d311cc56af0adef,,
Pizza 4P’s Lê Thánh Tôn,"Lê Thánh Tôn, Bến Nghé, Quận 1, Thành phố Hồ Chí Minh 700000, Việt Nam",+84 1900 6043,4.8,Mở cửa lúc 10:00 ⋅ Đóng cửa vào 23:00,10.7818738,106.7051397,$$,,,0x31752f4937cb401d:0x985b0267c61f8139,,
Paper Plate Pizza - NY Style Pizza,"25/26B Tôn Thất Tùng, Phường Phạm Ngũ Lão, Quận 1, Thành phố Hồ Chí Minh, Việt Nam",+84 777 892 988,4.6,Mở cửa lúc 10:00 ⋅ Đóng cửa vào 21:30,10.770132799999999,106.687404,100-200 N ₫,,,0x31752f0b81d526ff:0x2ac8e8c8842b6f56,,
Pizza Hut Nguyễn Thị Minh Khai D3,"224 Nguyễn Thị Minh Khai, Phường 6, Quận 3, Thành phố Hồ Chí Minh 700000, Việt Nam",+84 1900 1822,4.8,Mở cửa lúc 10:00 ⋅ Đóng cửa vào 22:00,10.7745561,106.6899381,100-300 N ₫,,,0x31752f4569d9f90b:0x89594c77d8dce85b,,
Pubblico - Pizza Al Taglio & Focaccia,"63 Đông Du, Bến Nghé, Quận 1, Thành phố Hồ Chí Minh, Việt Nam",+84 779 101 087,4.9,Mở cửa lúc 10:00 ⋅ Đóng cửa vào 22:30,10.775410899999999,106.7041494,100-200 N ₫,,,0x31752fa1d726dc27:0xd7b0f79ad271ba44,,
"Truffle & Co. Mac Thi Buoi, Italian Restaurant Pizza & Pasta","36 Mạc Thị Bưởi, Bến Nghé, Quận 1, Thành phố Hồ Chí Minh, Việt Nam",+84 383 909 388,4.9,Mở cửa lúc 9:00 ⋅ Đóng cửa vào 22:30,10.7755146,106.7048143,,,,0x31752f00264a63b7:0x7e2415e203cbf710,,
Lam Pizza,"280/33/7 Cách Mạng Tháng Tám, Phường 9, Quận 3, Thành phố Hồ Chí Minh 70000, Việt Nam",+84 903 676 232,4.7,Mở cửa lúc 9:00 ⋅ Đóng cửa vào 22:00,10.781460599999999,106.6769205,100-200 N ₫,,,0x31752f6a6fae69c9:0x32e225a8651536ca,,
Truffle & Co.,"Sài Gòn Centre, Saigon Centre Shopping Mall, 65 Lê Lợi, Bến Nghé, Quận 1, Thành phố Hồ Chí Minh 700000, Việt Nam",+84 817 222 388,4.9,Mở cửa lúc 10:00 ⋅ Đóng cửa vào 22:00,10.7733332,106.7006512,,,,0x31752fedd9f78a87:0xba8a05ffe20f6220,,
lasi pizza,"42 Nguyễn Huệ, quận 1, Quận 1, Thành phố Hồ Chí Minh 700000, Việt Nam",+84 903 822 190,5.0,Mở cửa lúc 10:00 ⋅ Đóng cửa vào 22:00,10.774102,106.7040848,200-300 N ₫,,,0x31752f5152062523:0xdb5735e436f1cd84,,
The Pizza Company Nguyễn Thái Học,"Nguyễn Thái Học, Phường Cầu Ông Lãnh, Quận 1, Thành phố Hồ Chí Minh, Việt Nam",+84 1900 6066,4.1,Mở cửa lúc 10:00 ⋅ Đóng cửa vào 22:00,10.7674506,106.6953332,100-200 N ₫,,,0x31752f158b4720cf:0xb001e0f6e2726234,,
Amano Pizza - Lê Thánh Tôn,"200/25 Lê Thánh Tôn, Phường Bến Thành, Quận 1, Thành phố Hồ Chí Minh, Việt Nam",+84 399 526 266,4.8,Mở cửa vào 17:00 ⋅ Đóng cửa vào 19:00,10.7730146,106.6966866,200-400 N ₫,,,0x31752f1c3c39c3d1:0x74ed251688fb2539,,
The Pizza Company Nguyễn Thị Minh Khai,"506 - 508 Nguyễn Thị Minh Khai, Phường 2, Quận 3, Thành phố Hồ Chí Minh, Việt Nam",+84 1900 6066,4.2,Mở cửa lúc 10:00 ⋅ Đóng cửa vào 22:00,10.7659819,106.6820295,100-200 N ₫,,,0x31752f1f2b03cab9:0xe4514d793a031f75,,
Bella Pizza Italia,"633/57 Điện Biên Phủ, Phường 1, Quận 3, Thành phố Hồ Chí Minh 700000, Việt Nam",+84 903 168 312,4.8,Mở cả ngày,10.767747799999999,106.6778374,100-300 N ₫,,,0x31752f00471f20a9:0xa41de4cec757ce50,,
Pizza 4P's Vincom Plaza 3/2,"TTTM Vincom Plaza, Lô L1-14B, tầng L1, Đ. 3 Tháng 2, Phường 10, Quận 10, Thành phố Hồ Chí Minh 700910, Việt Nam",,5.0,Mở cửa lúc 9:00 ⋅ Đóng cửa vào 22:30,10.776144,106.6806563,$$,,,0x31752fa20abaf647:0xe37a2b206b3e930c,,
Pizza 4P's Thiso Mall,"10 Mai Chí Thọ, Thủ Thiêm, Thủ Đức, Thành phố Hồ Chí Minh, Việt Nam",+84 1900 6043,5.0,Mở cửa lúc 9:00 ⋅ Đóng cửa vào 22:00,10.772146699999999,106.7228724,$$,,,0x31752fe6a892f76b:0xfdaabcc97ee2d1e2,,
Pizza Hut - Thiso Mall,"8 10 Mai Chí Thọ, Thủ Thiêm, Thủ Đức, Thành phố Hồ Chí Minh 700000, Việt Nam",+84 1900 1822,4.9,Mở cửa lúc 10:00 ⋅ Đóng cửa vào 22:00,10.7717276,106.7226586,$$,,,0x31752f0de708e1bf:0xd69f420f44d91b53,,
Pizza & Bia,"24/4 Phạm Ngọc Thạch, Phường 6, Quận 3, Thành phố Hồ Chí Minh, Việt Nam",+84 28 3823 9398,4.7,Mở cửa lúc 10:00 ⋅ Đóng cửa vào 22:30,10.7843564,106.6943512,200-300 N ₫,,,0x31752f33866e99f3:0xf04be0cac15409b6,,
Pizza Hut Nguyễn Tri Phương,"397 Nguyễn Tri Phương, Phường 8, Quận 10, Thành phố Hồ Chí Minh 700000, Việt Nam",+84 1900 1822,4.6,Mở cửa lúc 10:00 ⋅ Đóng cửa vào 22:00,10.763371,106.667876,100-200 N ₫,,,0x31752ee4294b27c3:0x2b428aa39b8f7260,,
Oliver's Pizza,"Hẻm 85 Phạm Viết Chánh, Phường 19, Bình Thạnh, Thành phố Hồ Chí Minh, Việt Nam",+84 933 502 638,4.6,Mở cửa lúc 10:00 ⋅ Đóng cửa vào 2:00,10.7903656,106.7117273,100-200 N ₫,,,0x31752f34e6e05cc7:0xa7b543aaad8de924,,
Pizza 4P's Saigon Pearl,"Ruby Home 1, 92 Nguyễn Hữu Cảnh, Saigon Pearl, Bình Thạnh, Thành phố Hồ Chí Minh 70000, Việt Nam",+84 1900 6043,5.0,Mở cửa lúc 10:00 ⋅ Đóng cửa vào 23:00,10.7895881,106.7207971,$$,,,0x317529cbd33b4df9:0x39d3bd05b8fb6400,,
Hẻm Pizza (Caznapizza),"Nguyễn Trọng Tuyển, Phường 15, Phú Nhuận, Thành phố Hồ Chí Minh 700000, Việt Nam",+84 911 788 339,5.0,Mở cửa lúc 9:00 ⋅ Đóng cửa vào 23:00,10.7967134,106.679139,100-200 N ₫,,,0x317529f08129c19f:0xd1fb7b3b7e490a77,,
Pizza Alegria 128 Phan Xích Long,"128 Phan Xích Long, Phường 7, Phú Nhuận, Thành phố Hồ Chí Minh 72212, Việt Nam",+84 931 283 496,4.9,Mở cửa lúc 9:00 ⋅ Đóng cửa vào 0:00,10.7974556,106.6919838,100-200 N ₫,,,0x317529003b236cb5:0x34c73805c33991d2,,
Pizza Piatto,"CƯ XÁ, Đ. Lý Thường Kiệt/91K Nguyễn Kim, Phường 6, Quận 10, Thành phố Hồ Chí Minh 700000, Việt Nam",+84 346 627 237,5.0,Mở cửa lúc 10:00 ⋅ Đóng cửa vào 20:00,10.7609123,106.6617272,100-200 N ₫,,,0x31752f6948811669:0x74d341676c984c92,,
The Pizza Company Cửu Long,"74 Cửu Long, Phường 15, Quận 10, Thành phố Hồ Chí Minh 700000, Việt Nam",+84 1900 6066,4.2,Mở cửa lúc 10:00 ⋅ Đóng cửa vào 22:00,10.782680899999999,106.661754,200-300 N ₫,,,0x31752fb521ed0e53:0xb1a72fcf2e228ea2,,
Jimmy’s New York Pizza - D1,"50 Đặng Thị Nhu, Phường Nguyễn Thái Bình, Quận 1, Thành phố Hồ Chí Minh 700000, Việt Nam",+84 931 334 509,4.5,Mở cửa lúc 10:00 ⋅ Đóng cửa vào 0:00,10.7691071,106.6969772,,,,0x31752f48ff6c3507:0xd2518161905579bc,,
Pizza Hut,"451 Đ. Lê Văn Sỹ, Phường 12, Quận 3, Thành phố Hồ Chí Minh, Việt Nam",+84 1900 1822,4.7,Mở cửa lúc 10:00 ⋅ Đóng cửa vào 22:00,10.789549,106.674518,100-200 N ₫,,,0x31752ed539117fb1:0x34cd92e0ba2d6aed,,
Domino's Pizza Lê Văn Sỹ,"335A Đ. Lê Văn Sỹ, Phường 1, Tân Bình, Thành phố Hồ Chí Minh 700000, Việt Nam",+84 1900 6099,4.4,Mở cửa lúc 10:00 ⋅ Đóng cửa vào 22:00,10.7956975,106.6660782,100-200 N ₫,,,0x31752ed540d813a3:0x22d243f88e3ddd7,,
Italiani's Pizza Parc Mall,"549 Đ. Tạ Quang Bửu, Phường 4, Quận 8, Thành phố Hồ Chí Minh, Việt Nam",+84 838 932 828,4.9,Mở cửa lúc 10:00 ⋅ Đóng cửa vào 22:00,10.7411403,106.6793459,200-300 N ₫,,,0x31752fc1fd36e6b5:0x3ca561f25c9aacf3,,
Pizza Hut,"TTTM Parc Mall, 547-549 Đ. Tạ Quang Bửu, Phường 4, Quận 8, Thành phố Hồ Chí Minh 100000, Việt Nam",,4.9,Mở cửa lúc 9:00 ⋅ Đóng cửa vào 22:00,10.740714599999999,106.679465,100-300 N ₫,,,0x31752f108e919275:0xe680aa25a828b340,,
Pasta Danza Cafe,"164 Nguyễn Công Trứ, Phường Nguyễn Thái Bình, Quận 1, Thành phố Hồ Chí Minh 72000, Việt Nam",,4.7,Mở cửa lúc 10:00 ⋅ Đóng cửa vào 22:00,10.7688361,106.7013349,100-200 N ₫,,,0x31752f2f340190e3:0x94fc736f21ceb194,,
Domino's Pizza Khánh Hội,"133 Khánh Hội, Phường 3, Quận 4, Thành phố Hồ Chí Minh 700000, Việt Nam",+84 1900 6099,4.1,Mở cửa lúc 9:00 ⋅ Đóng cửa vào 22:00,10.7558853,106.7012117,100-200 N ₫,,,0x31752f72a24132b3:0x1b88fa36ec833892,,
Leonardo Pizza,"229 Nguyễn Công Trứ, Phường Nguyễn Thái Bình, Quận 1, Thành phố Hồ Chí Minh 700000, Việt Nam",+84 961 352 753,4.7,Mở cửa lúc 16:00 ⋅ Đóng cửa vào 18:00,10.7677169,106.7004334,200-300 N ₫,,,0x31752f29a08a82ff:0x4bf4ae413a1a9ea9,,
Redfox Pizza,"Nguyễn Khoái/91/2a Đ. Vĩnh Hội, Phường, Quận 4, Thành phố Hồ Chí Minh 70000, Việt Nam",+84 933 436 376,4.9,Mở cửa lúc 16:00 ⋅ Đóng cửa vào 19:00,10.7557526,106.6937669,100-200 N ₫,,,0x31752ff53f066849:0x9e6711b8713a7329,,
Pizza Hut,"453 Đ. Nguyễn Thị Thập, Tân Phong, Quận 7, Thành phố Hồ Chí Minh 700000, Việt Nam",+84 1900 1822,4.9,Mở cửa lúc 9:00 ⋅ Đóng cửa vào 22:00,10.738637299999999,106.7105722,100-200 N ₫,,,0x31752f0dc00a19db:0xe9d6152af7febf79,,
Domino's Pizza,"24 Phạm Hồng Thái, Phường Bến Thành, Quận 1, Thành phố Hồ Chí Minh 700000, Việt Nam",+84 1900 6099,4.1,Mở cửa lúc 10:00 ⋅ Đóng cửa vào 22:00,10.7713696,106.6960459,100-200 N ₫,,,0x31752fe9a6de6867:0xc9e48ba9246989ea,,
PIZZA777 - QUẬN 4,"237/42/5 Hoàng Diệu, Phường 9, Quận 4, Thành phố Hồ Chí Minh 70000, Việt Nam",+84 877 771 077,4.0,Mở cửa lúc 9:00 ⋅ Đóng cửa vào 21:00,10.7621826,106.702399,1-100.000 ₫,,,0x317529302e8d4c3f:0xc00898f5476774ae,,
Pizza Hut Liberty Quận 7,"544 Huỳnh Tấn Phát, Bình Thuận, Quận 7, Thành phố Hồ Chí Minh 700000, Việt Nam",+84 1900 1822,4.9,Mở cửa lúc 9:00 ⋅ Đóng cửa vào 22:00,10.7379302,106.7301635,100-200 N ₫,,,0x31752514c2252f3f:0xf8600f1bebb48a52,,
The Pizza Company Huỳnh Tấn Phát,"346 Huỳnh Tấn Phát, Bình Thuận, Quận 7, Thành phố Hồ Chí Minh, Việt Nam",+84 1900 6066,4.1,Mở cửa lúc 9:00 ⋅ Đóng cửa vào 22:00,10.748619699999999,106.7285116,200-300 N ₫,,,0x3175258144e18d55:0x5997a3fb17a8da2d,,
The Pizza Company Hậu Giang,"167 Đ. Hậu Giang, Phường 5, Quận 6, Thành phố Hồ Chí Minh 700000, Việt Nam",+84 1900 6066,4.4,Mở cửa lúc 10:00 ⋅ Đóng cửa vào 22:00,10.749439299999999,106.6453775,100-200 N ₫,,,0x31752f40a161e0eb:0x1d10229a5b318f38,,
Domino's Pizza Liên Tỉnh 5,"240 QL50, Phường 6, Quận 8, Thành phố Hồ Chí Minh 700000, Việt Nam",+84 1900 6099,4.4,Mở cửa lúc 9:00 ⋅ Đóng cửa vào 22:00,10.73598,106.655919,100-200 N ₫,,,0x31752f9f57763dbd:0x85802c43f979e396,,
Pizza Hut Phạm Hùng,"364 Đ. Phạm Hùng, Phường 5, Quận 8, Thành phố Hồ Chí Minh 700000, Việt Nam",+84 1900 1822,4.8,Mở cửa lúc 10:00 ⋅ Đóng cửa vào 22:00,10.7367049,106.6711616,$$,,,0x31752e520f943003:0xa6e40ef91fafa18c,,
PIZZA 777,"4 Đ. Ngô Quyền, Phường 5, Quận 5, Thành phố Hồ Chí Minh 70000, Việt Nam",+84 877 771 077,4.7,Mở cửa vào 17:00 ⋅ Đóng cửa vào 19:00,10.750814799999999,106.6672066,100-200 N ₫,,,0x31752fdd98c81455:0x2ce761e920f8b63b,,
PIZZA MOSAIC,"377 Đ. Phan Văn Trị, Phường 2, Quận 5, Thành phố Hồ Chí Minh, Việt Nam",+84 906 631 825,4.4,Mở cửa lúc 9:00 ⋅ Đóng cửa vào 21:00,10.7554161,106.6771166,100-200 N ₫,,,0x31752f2166f60f01:0xfdb867fcae55d497,,
BunBun pizza,"605 Đ.Tùng Thiện Vương, phường 12, Quận 8, Thành phố Hồ Chí Minh, Việt Nam",+84 909 355 212,5.0,Mở cửa lúc 10:00 ⋅ Đóng cửa vào 23:00,10.7431015,106.655658,1-100.000 ₫,,,0x31752ff83349a57b:0xb5a7416042b2e4a8,,
Pizza Bòn Bon,"124 Bùi Minh Trực, Phường 5, Quận 8, Thành phố Hồ Chí Minh, Việt Nam",,5.0,Mở cửa lúc 9:00 ⋅ Đóng cửa vào 22:00,10.7389206,106.6596051,,,,0x31752e429f884a2b:0x42b74843ad69cd46,,
Pizza Hut Hậu Giang,"164B Đ. Hậu Giang, Phường 2, Quận 6, Thành phố Hồ Chí Minh 700000, Việt Nam",+84 1900 1822,4.6,Mở cửa lúc 9:00 ⋅ Đóng cửa vào 22:00,10.749867499999999,106.6440754,100-300 N ₫,,,0x31752e89ccfa3bfb:0x1e84332938f79971,,
Pizza Hut,"264-266 Nguyễn Trãi, Phường 7, Quận 5, Thành phố Hồ Chí Minh 700000, Việt Nam",+84 1900 1822,5.0,Mở cửa lúc 9:00 ⋅ Đóng cửa vào 22:00,10.7565055,106.6760848,100-200 N ₫,,,0x31752fe7063cb6e5:0xa42eeb4881773534,,
The Pizza Company Phạm Hùng,"322B Đ. Phạm Hùng, Phường 5, Quận 8, Thành phố Hồ Chí Minh 700000, Việt Nam",+84 1900 6066,4.2,Mở cửa lúc 9:00 ⋅ Đóng cửa vào 22:00,10.7385951,106.6696626,100-200 N ₫,,,0x31752e518494a627:0x943751af1a9b6de0,,
Domino's Pizza,"251F Đ. Hậu Giang, Phường 2, Quận 6, Thành phố Hồ Chí Minh 700000, Việt Nam",+84 1900 6099,4.3,Mở cửa lúc 9:00 ⋅ Đóng cửa vào 22:00,10.7496359,106.6435097,100-200 N ₫,,,0x31752e88218d54a3:0xcb564259cea891c2,,
Pizza Inn Huỳnh Mẫn Đạt,"77A Đ. Huỳnh Mẫn Đạt, Phường 7, Quận 5, Thành phố Hồ Chí Minh 700000, Việt Nam",+84 28 3924 0343,4.2,Mở cửa lúc 9:00 ⋅ Đóng cửa vào 21:00,10.7544232,106.6766685,100-200 N ₫,,,0x31752f02a3b751e3:0xacfeb33dedee4172,,
Domino's Pizza Nguyễn Tri Phương,"313 Nguyễn Tri Phương, Phường 8, Quận 10, Thành phố Hồ Chí Minh 700000, Việt Nam",+84 1900 6099,4.1,Mở cửa lúc 10:00 ⋅ Đóng cửa vào 22:00,10.761692199999999,106.6681969,100-200 N ₫,,,0x31752ee444e238f3:0xf6d107c2f69b0b2d,,
Pizza 4P's Lê Đại Hành,"The Emporium Building, Phu Tho Ward, 184 Đ. Lê Đại Hành, Phường 15, Quận 11, Thành phố Hồ Chí Minh 70000, Việt Nam",+84 1900 6043,4.9,Mở cửa lúc 10:00 ⋅ Đóng cửa vào 22:00,10.764909,106.6556152,$$,,,0x31752f0cd6a048fd:0x461d8d512e9a723f,,
Pizza PHU,"377/84 Đ. Lê Đại Hành, Phường 11, Quận 11, Thành phố Hồ Chí Minh, Việt Nam",+84 933 649 208,4.8,Mở cửa lúc 9:00 ⋅ Đóng cửa vào 21:30,10.766402,106.653063,100-200 N ₫,,,0x31752f004fceb945:0xa7ee6e70f482c41b,,
The Pizza Company Bà Hom,"Bà Hom, Phường 14, Quận 6, Thành phố Hồ Chí Minh, Việt Nam",+84 1900 6066,4.3,Mở cửa lúc 10:00 ⋅ Đóng cửa vào 22:00,10.755014,106.6303091,100-200 N ₫,,,0x31752e818b3a36bb:0xb981cedd08bc2e1d,,
The Pizza Company Parc Mall,"TTTM Parc Mall:, 547 - 549 Đ. Tạ Quang Bửu, Phường 4, Quận 8, Thành phố Hồ Chí Minh, Việt Nam",+84 1900 6066,3.9,Mở cửa lúc 9:00 ⋅ Đóng cửa vào 22:00,10.7404475,106.6787347,,,,0x31752f629cd95b57:0xbd31facf46b816e6,,
Pizza Hut,"L1-07, tầng 1, Chung cư cụm III, IV, Đ. số 9A, Khu dân cư Trung Sơn, Thành phố Hồ Chí Minh, 700000, Việt Nam",+84 1900 1822,5.0,Mở cửa lúc 10:00 ⋅ Đóng cửa vào 20:00,10.7322326,106.6891678,100-300 N ₫,,,0x31752f19475eba5d:0xb03a1898372aee0f,,
The Pizza Company Lê Đại Hành,"Chung cư Phú Thọ: Lô 4 - Khu B - Căn, 7 Đ. Lê Đại Hành, Phường 15, Quận 11, Thành phố Hồ Chí Minh, Việt Nam",+84 1900 6066,4.3,Mở cửa lúc 9:00 ⋅ Đóng cửa vào 22:00,10.7687887,106.6527763,100-200 N ₫,,,0x31752e954b3ea7f9:0xedd2c1234d496fd0,,
The Pizza Company Hòa Bình,"78D-80, Đ. Hòa Bình, Phường 5, Quận 11, Thành phố Hồ Chí Minh, Việt Nam",+84 1900 6066,4.3,Mở cửa lúc 10:00 ⋅ Đóng cửa vào 22:00,10.7688869,106.6390431,$$,,,0x31752e9764e303e3:0x77d285d56c1346eb,,
The Pizza Company - Vạn Hạnh Mall,"TTTM Vạn Hạnh Mall:, 11 Sư Vạn Hạnh, Phường 12, Quận 10, Thành phố Hồ Chí Minh, Việt Nam",+84 1900 6066,4.1,Mở cửa lúc 10:00 ⋅ Đóng cửa vào 22:00,10.7706526,106.6695267,100-200 N ₫,,,0x31752eddde073a59:0x7ee393eaccbe82e7,,
Steak Bin & Pizza Lãnh Binh Thăng,"329 Lãnh Binh Thăng, Phường 8, Quận 11, Thành phố Hồ Chí Minh, Việt Nam",+84 858 626 656,4.1,Mở cửa lúc 10:00 ⋅ Đóng cửa vào 22:00,10.764712,106.6473819,100-200 N ₫,,,0x31752f9a2e89167b:0x58a111fc6a8f652a,,
Pizza vỉa hè tự chọn,"3C Đ. Bình Thới, Phường 11, Quận 11, Thành phố Hồ Chí Minh, Việt Nam",,4.3,Mở cửa lúc 16:00 ⋅ Đóng cửa vào 18:00,10.7686576,106.6518828,1-100.000 ₫,,,0x31752e9547f0c191:0x3e9d17b1050919f8,,
Pizza Hut Signature Aeon Mall Bình Tân,"Aeon Mall Bình Tân, Tầng 3, Số 1, đường số 17A, kp 11, P, 700000, Việt Nam",+84 1900 1822,4.9,Mở cửa lúc 10:00 ⋅ Đóng cửa vào 22:00,10.7426,106.61166,100-200 N ₫,,,0x31752dcedacd35ab:0x75dbfb38ef9d214c,,
Pizza Có Tâm | Pizza Nướng Củi,"13/11 Đ. Số 1, An Lạc A, Bình Tân, Thành phố Hồ Chí Minh 760000, Việt Nam",+84 932 098 090,4.8,Mở cửa lúc 16:00 ⋅ Đóng cửa vào 19:00,10.747775899999999,106.621327,100-200 N ₫,,,0x31752df1d05eb62d:0xddbe50152ccc56d3,,
The Pizza Company Vành Đai Trong,"Đ. Vành Đai Trong, Bình Trị Đông, Bình Tân, Thành phố Hồ Chí Minh, Việt Nam",+84 1900 6066,4.3,Mở cửa lúc 10:00 ⋅ Đóng cửa vào 22:00,10.7520391,106.6149585,200-300 N ₫,,,0x31752d40a220ed25:0x6672a21d3cb2da3b,,
Pizza & Trà sữa NGON,"88 Lê Cơ, An Lạc, Bình Tân, Thành phố Hồ Chí Minh, Việt Nam",+84 909 040 768,3,Mở cửa lúc 10:00 ⋅ Đóng cửa vào 22:00,10.7283685,106.6121956,,,,0x31752d532dc798e3:0xc3bf6b2cc5e230c1,,
Go Gelato (Restaurant - Bakery & Coffee),"541 Đ. Kinh Dương Vương, An Lạc, Bình Tân, Thành phố Hồ Chí Minh 700000, Việt Nam",+84 28 3620 5578,4.5,Mở cửa lúc 10:00 ⋅ Đóng cửa vào 22:00,10.736368599999999,106.6142686,100-200 N ₫,,,0x31752ddbbb71edb5:0x34d56751d6a0b463,,
Domino's Pizza Tên Lửa,"350 Đ. Tên Lửa, Bình Trị Đông B, Bình Tân, Thành phố Hồ Chí Minh, Việt Nam",+84 1900 6099,4.2,Mở cửa lúc 10:00 ⋅ Đóng cửa vào 22:00,10.752086799999999,106.6106096,100-200 N ₫,,,0x31752c349752068d:0xe3670277b7fcba7d,,
Dạy lái xe ô tô Sao Việt,"33 Đường Số 26, Phường 16, Quận 8, Thành phố Hồ Chí Minh, Việt Nam",+84 946 368 099,5,Không rõ giờ mở cửa,10.7191688,106.6232999,,,,0x31752da7eff2abcd:0x403bb4603d75c4f5,,
Pizza Hut,"348 TL10, P, Bình Tân, Thành phố Hồ Chí Minh 70000, Việt Nam",+84 1900 1822,4.8,Mở cửa lúc 9:00 ⋅ Đóng cửa vào 22:00,10.756604099999999,106.6233673,100-300 N ₫,,,0x31752d2497522269:0xa514e33d535ceb9b,,
Pizza Ý Doremi Quận 6( Thanh Thảo),"269/35A Bà Hom, Phường 13, Quận 6, Thành phố Hồ Chí Minh, Việt Nam",+84 934 323 278,4.7,Mở cửa lúc 10:00 ⋅ Đóng cửa vào 21:00,10.754289499999999,106.6250959,,,,0x31752dce626845c5:0xb5d437e7617e9ac1,,
Pizza O’i,"34 Đ. số 9, Bình Hưng, Bình Chánh, Thành phố Hồ Chí Minh, Việt Nam",,,Mở cửa vào 16:30 ⋅ Đóng cửa vào 20:00,10.725828,106.6518695,,,,0x31752fa443ede29f:0xc9d8972059d9bd86,,
The Pizza Company Quốc Lộ 50,"312 QL50, Phường 6, Quận 8, Thành phố Hồ Chí Minh, Việt Nam",+84 1900 6066,4.2,Mở cửa lúc 10:00 ⋅ Đóng cửa vào 22:00,10.732807,106.655837,100-200 N ₫,,,0x31752f7d852db085:0x1d4aef366a491e8c,,
Pizza,"613 Cầu Nhị Thiên Đường, Phường Xóm Củi, Quận 8, Thành phố Hồ Chí Minh, Việt Nam",,5.0,Không rõ giờ mở cửa,10.7429996,106.6556841,,,,0x31752f0010c74f35:0x7611c683d7c1aba0,,
Pizza Kim - Napoli Pizza - Bông Sao,"108 Bông Sao, Phường 5, Quận 8, Thành phố Hồ Chí Minh, Việt Nam",+84 398 601 860,5.0,Mở cửa lúc 10:00 ⋅ Đóng cửa vào 20:30,10.7393517,106.6620364,,,,0x31752f0023f84f69:0x3c8ca8802399c2c2,,
PIZZA 3B - 179 Trần Huy Liệu,"Tầng Trệt, 179 Đ. Trần Huy Liệu, Phường 8, Phú Nhuận, Thành phố Hồ Chí Minh, Việt Nam",+84 906 374 905,4.6,Mở cửa lúc 9:00 ⋅ Đóng cửa vào 22:00,10.7971804,106.6775153,,,,0x317529de1a2ed501:0xf04e5d8288c51091,,
Pizza LaPoza,"1B đường 42, Tân Quy, Quận 7, Thành phố Hồ Chí Minh 70000, Việt Nam",+84 869 900 133,4.8,Mở cửa lúc 9:00 ⋅ Đóng cửa vào 21:45,10.739551599999999,106.7130716,100-200 N ₫,,,0x31752fcc31170ef5:0xeb455e17b60aab5c,,
Pizza 4P's Phú Mỹ Hưng,"Toà nhà Cobi Tower II, 2-4 Đường Số 8, Tân Phú, Quận 7, Thành phố Hồ Chí Minh 70000, Việt Nam",+84 1900 6043,4.9,Mở cửa lúc 9:00 ⋅ Đóng cửa vào 22:30,10.7308117,106.7245202,$$,,,0x31752f8f1b85f2e7:0x5f1b89599086065d,,
Margherí pizza Phú Mỹ Hưng,"Hưng Phước 4/60 Khu P.Mỹ Hưng, Tân Phong, Quận 7, Thành phố Hồ Chí Minh, Việt Nam",+84 338 424 925,4.5,Mở cửa lúc 10:00 ⋅ Đóng cửa vào 22:00,10.7297896,106.7077113,,,,0x31752f478c58124f:0x43e64271ad3c1d67,,
PIZZA 3 Phú Mỹ Hưng,"90 Số 49, Tân Quy, Quận 7, Thành phố Hồ Chí Minh 72900, Việt Nam",,4.4,Mở cửa lúc 9:00 ⋅ Đóng cửa vào 23:00,10.741646,106.7149361,,,,0x31752f2e79ff15ed:0xab9df14f11d288e2,,
Pizza Inn 피자인 푸미흥,"Mỹ Phước, c.c, C001 Phạm Thái Bường, Tân Phong, Quận 7, Thành phố Hồ Chí Minh 700000, Việt Nam",+84 28 5412 1197,4.2,Mở cửa lúc 9:00 ⋅ Đóng cửa vào 21:00,10.727832399999999,106.7107486,100-200 N ₫,,,0x31752f93acc3b9f9:0x1abb1a535640483b,,
Jimmy’s New York Pizza - D7,"Cảnh Viên 3, 66 Đường C, Tân Phú, Quận 7, Thành phố Hồ Chí Minh 700000, Việt Nam",+84 896 741 099,4.6,Mở cửa lúc 9:00 ⋅ Đóng cửa vào 23:00,10.721362899999999,106.7291676,200-300 N ₫,,,0x317525ec2a455023:0x9f98535ecf85e921,,
